{
  "id": "z_enc_baixo_orvalho_praca",
  "versao": 1,
  "nota": "Encontro aleatório por passos (13, D-031). Zonas em retângulos inclusivos de tiles [x0, z0, x1, z1]. Zona segura vence zona de encontro; entre zonas de encontro sobrepostas vale a primeira da lista. Valores provisórios do M1 (o 14 ajusta o desenho; o 06 a taxa).",
  "mapa": "map_baixo_orvalho_praca",
  "ligado": true,
  "tiles_por_passo": 1,
  "passos_minimos": 12,
  "passos_carencia_pos_batalha": 8,
  "taxa_por_passo": 0.08,
  "zonas_seguras": [
    { "id": "z_seguro_praca", "ret": [14, 14, 35, 34] },
    { "id": "z_seguro_treino", "ret": [6, 19, 20, 29] }
  ],
  "zonas_encontro": [
    { "id": "z_enc_norte", "ret": [0, 0, 47, 9], "tabela": [{ "encontro": "enc_slime_1", "peso": 3 }, { "encontro": "enc_lobo_1", "peso": 1 }] },
    { "id": "z_enc_sul", "ret": [0, 38, 47, 47], "tabela": [{ "encontro": "enc_slime_1", "peso": 1 }, { "encontro": "enc_lobo_1", "peso": 2 }, { "encontro": "enc_misto_1", "peso": 1 }] },
    { "id": "z_enc_leste", "ret": [38, 10, 47, 37], "tabela": [{ "encontro": "enc_lobo_1", "peso": 2 }, { "encontro": "enc_misto_1", "peso": 1 }] },
    { "id": "z_enc_oeste", "ret": [0, 10, 5, 37], "tabela": [{ "encontro": "enc_slime_1", "peso": 2 }, { "encontro": "enc_misto_1", "peso": 1 }] }
  ]
}
